{
  "schema_version": "kzhc.bid-ops.v1",
  "module": "S2",
  "run_id": "KZHC-20261010-S2-001",
  "project_id": "N5100012026002044",
  "bidder_name": "四川省科智汇川人工智能科技有限责任公司",
  "source_mode": "REAL_INPUT",
  "input_refs": [
    {
      "source_id": "SRC-BRIEF",
      "file_name": "tender_brief.json",
      "relative_path": "tender_brief.json",
      "kind": "tender_brief",
      "origin": "S1 output",
      "sha256": "eb2a53d04479c2dbe1ba91d15b2619743d866e841b02d8e35d111d280af236f1",
      "version": "kzhc.bid-ops.v1"
    }
  ],
  "processing_status": "REVIEW",
  "issues": [
    {
      "code": "GATE_MATERIAL_MISSING",
      "message": "48 条准入级要求（mandatory / ★）对应的资料缺失或过期，按现状投标存在废标风险。",
      "source_ref": "data.items（severity=GATE 且 status∈{MISSING,EXPIRED}）",
      "owner": "投标负责人",
      "action": "逐条补齐准入级材料或评估放弃投标；不得以其他材料类比替代。"
    },
    {
      "code": "EMPTY_MATERIAL_LIBRARY",
      "message": "资料库为空，本次核对结果为阴性对照（全部缺失），不代表本公司真实缺口。",
      "source_ref": "C:/Users/Administrator/WorkBuddy/2026-10-10-14-35-02/kzhc-bid/materials",
      "owner": "投标负责人",
      "action": "放入真实材料后重跑本步骤。"
    },
    {
      "code": "PROFILE_NOT_FILLED",
      "message": "company_profile.yaml 已解析但几乎无有效内容（仅主体名称），所有依赖公司资质的条目均判为缺失。",
      "source_ref": "C:/Users/Administrator/WorkBuddy/2026-10-10-14-35-02/kzhc-bid/company_profile.yaml",
      "owner": "投标负责人",
      "action": "按 references/company-profile-guide.md 逐项如实填报，并附证明材料文件名。"
    }
  ],
  "data": {
    "profile_ref": {
      "path": "C:/Users/Administrator/WorkBuddy/2026-10-10-14-35-02/kzhc-bid/company_profile.yaml",
      "loaded": true,
      "filled_field_count": 1,
      "identity_company_name": "四川省科智汇川人工智能科技有限责任公司",
      "filled_by": null
    },
    "materials_scanned": [
      {
        "path": "C:/Users/Administrator/WorkBuddy/2026-10-10-14-35-02/kzhc-bid/materials",
        "file_count": 0
      }
    ],
    "material_index": [],
    "items": [
      {
        "material_id": "MATREQ-001",
        "material_name": "格式与装订规范",
        "material_type": "FORMAT_RULE",
        "matched_requirement_ids": [
          "REQ-001"
        ],
        "matched_asset_refs": [],
        "status": "REVIEW",
        "severity": "GATE",
        "reason": "格式与装订规范类要求，不消耗公司资质资料",
        "gap_detail": "由标书编制环节按招标格式要求落实；编制完成后逐项自查",
        "owner": "投标负责人",
        "reviewer": null
      },
      {
        "material_id": "MATREQ-002",
        "material_name": "格式与装订规范",
        "material_type": "FORMAT_RULE",
        "matched_requirement_ids": [
          "REQ-002"
        ],
        "matched_asset_refs": [],
        "status": "REVIEW",
        "severity": "GATE",
        "reason": "格式与装订规范类要求，不消耗公司资质资料",
        "gap_detail": "由标书编制环节按招标格式要求落实；编制完成后逐项自查",
        "owner": "投标负责人",
        "reviewer": null
      },
      {
        "material_id": "MATREQ-003",
        "material_name": "财务与审计材料",
        "material_type": "FINANCIAL_AUDIT",
        "matched_requirement_ids": [
          "REQ-003"
        ],
        "matched_asset_refs": [],
        "status": "MISSING",
        "severity": "GATE",
        "reason": "profile.financials 未填报或未附审计报告",
        "gap_detail": "准备近三年财务审计报告或财务报表，登记年度与关键指标",
        "owner": "投标负责人",
        "reviewer": null
      },
      {
        "material_id": "MATREQ-004",
        "material_name": "格式与装订规范",
        "material_type": "FORMAT_RULE",
        "matched_requirement_ids": [
          "REQ-004"
        ],
        "matched_asset_refs": [],
        "status": "REVIEW",
        "severity": "GATE",
        "reason": "格式与装订规范类要求，不消耗公司资质资料",
        "gap_detail": "由标书编制环节按招标格式要求落实；编制完成后逐项自查",
        "owner": "投标负责人",
        "reviewer": null
      },
      {
        "material_id": "MATREQ-005",
        "material_name": "财务与审计材料",
        "material_type": "FINANCIAL_AUDIT",
        "matched_requirement_ids": [
          "REQ-005"
        ],
        "matched_asset_refs": [],
        "status": "MISSING",
        "severity": "GATE",
        "reason": "profile.financials 未填报或未附审计报告",
        "gap_detail": "准备近三年财务审计报告或财务报表，登记年度与关键指标",
        "owner": "投标负责人",
        "reviewer": null
      },
      {
        "material_id": "MATREQ-006",
        "material_name": "格式与装订规范",
        "material_type": "FORMAT_RULE",
        "matched_requirement_ids": [
          "REQ-006"
        ],
        "matched_asset_refs": [],
        "status": "REVIEW",
        "severity": "GATE",
        "reason": "格式与装订规范类要求，不消耗公司资质资料",
        "gap_detail": "由标书编制环节按招标格式要求落实；编制完成后逐项自查",
        "owner": "投标负责人",
        "reviewer": null
      },
      {
        "material_id": "MATREQ-007",
        "material_name": "资质认证证书",
        "material_type": "QUALIFICATION_CERT",
        "matched_requirement_ids": [
          "REQ-007"
        ],
        "matched_asset_refs": [],
        "status": "MISSING",
        "severity": "GATE",
        "reason": "profile.qualifications 为空",
        "gap_detail": "梳理本公司全部资质证书，逐项登记名称、编号、发证机关、有效期",
        "owner": "投标负责人",
        "reviewer": null
      },
      {
        "material_id": "MATREQ-008",
        "material_name": "资质认证证书",
        "material_type": "QUALIFICATION_CERT",
        "matched_requirement_ids": [
          "REQ-008"
        ],
        "matched_asset_refs": [],
        "status": "MISSING",
        "severity": "GATE",
        "reason": "profile.qualifications 为空",
        "gap_detail": "梳理本公司全部资质证书，逐项登记名称、编号、发证机关、有效期",
        "owner": "投标负责人",
        "reviewer": null
      },
      {
        "material_id": "MATREQ-009",
        "material_name": "承诺函/声明/授权书",
        "material_type": "COMMITMENT",
        "matched_requirement_ids": [
          "REQ-009"
        ],
        "matched_asset_refs": [],
        "status": "MISSING",
        "severity": "GATE",
        "reason": "资料目录无承诺函类文件",
        "gap_detail": "按招标文件格式要求起草承诺函（格式类材料通常可自制），需法定代表人签署并盖章",
        "owner": "投标负责人",
        "reviewer": null
      },
      {
        "material_id": "MATREQ-010",
        "material_name": "资质认证证书",
        "material_type": "QUALIFICATION_CERT",
        "matched_requirement_ids": [
          "REQ-010"
        ],
        "matched_asset_refs": [],
        "status": "MISSING",
        "severity": "GATE",
        "reason": "profile.qualifications 为空",
        "gap_detail": "梳理本公司全部资质证书，逐项登记名称、编号、发证机关、有效期",
        "owner": "投标负责人",
        "reviewer": null
      },
      {
        "material_id": "MATREQ-011",
        "material_name": "资质认证证书",
        "material_type": "QUALIFICATION_CERT",
        "matched_requirement_ids": [
          "REQ-011"
        ],
        "matched_asset_refs": [],
        "status": "MISSING",
        "severity": "GATE",
        "reason": "profile.qualifications 为空",
        "gap_detail": "梳理本公司全部资质证书，逐项登记名称、编号、发证机关、有效期",
        "owner": "投标负责人",
        "reviewer": null
      },
      {
        "material_id": "MATREQ-012",
        "material_name": "产品与平台能力材料",
        "material_type": "CAPABILITY",
        "matched_requirement_ids": [
          "REQ-012"
        ],
        "matched_asset_refs": [],
        "status": "MISSING",
        "severity": "GATE",
        "reason": "profile.capability 为空",
        "gap_detail": "梳理可响应本项目技术要求的平台功能与案例，准备功能截图或演示环境",
        "owner": "投标负责人",
        "reviewer": null
      },
      {
        "material_id": "MATREQ-013",
        "material_name": "产品与平台能力材料",
        "material_type": "CAPABILITY",
        "matched_requirement_ids": [
          "REQ-013"
        ],
        "matched_asset_refs": [],
        "status": "MISSING",
        "severity": "GATE",
        "reason": "profile.capability 为空",
        "gap_detail": "梳理可响应本项目技术要求的平台功能与案例，准备功能截图或演示环境",
        "owner": "投标负责人",
        "reviewer": null
      },
      {
        "material_id": "MATREQ-014",
        "material_name": "产品与平台能力材料",
        "material_type": "CAPABILITY",
        "matched_requirement_ids": [
          "REQ-014"
        ],
        "matched_asset_refs": [],
        "status": "MISSING",
        "severity": "GATE",
        "reason": "profile.capability 为空",
        "gap_detail": "梳理可响应本项目技术要求的平台功能与案例，准备功能截图或演示环境",
        "owner": "投标负责人",
        "reviewer": null
      },
      {
        "material_id": "MATREQ-015",
        "material_name": "产品与平台能力材料",
        "material_type": "CAPABILITY",
        "matched_requirement_ids": [
          "REQ-015"
        ],
        "matched_asset_refs": [],
        "status": "MISSING",
        "severity": "GATE",
        "reason": "profile.capability 为空",
        "gap_detail": "梳理可响应本项目技术要求的平台功能与案例，准备功能截图或演示环境",
        "owner": "投标负责人",
        "reviewer": null
      },
      {
        "material_id": "MATREQ-016",
        "material_name": "产品与平台能力材料",
        "material_type": "CAPABILITY",
        "matched_requirement_ids": [
          "REQ-016"
        ],
        "matched_asset_refs": [],
        "status": "MISSING",
        "severity": "GATE",
        "reason": "profile.capability 为空",
        "gap_detail": "梳理可响应本项目技术要求的平台功能与案例，准备功能截图或演示环境",
        "owner": "投标负责人",
        "reviewer": null
      },
      {
        "material_id": "MATREQ-017",
        "material_name": "产品与平台能力材料",
        "material_type": "CAPABILITY",
        "matched_requirement_ids": [
          "REQ-017"
        ],
        "matched_asset_refs": [],
        "status": "MISSING",
        "severity": "GATE",
        "reason": "profile.capability 为空",
        "gap_detail": "梳理可响应本项目技术要求的平台功能与案例，准备功能截图或演示环境",
        "owner": "投标负责人",
        "reviewer": null
      },
      {
        "material_id": "MATREQ-018",
        "material_name": "产品与平台能力材料",
        "material_type": "CAPABILITY",
        "matched_requirement_ids": [
          "REQ-018"
        ],
        "matched_asset_refs": [],
        "status": "MISSING",
        "severity": "GATE",
        "reason": "profile.capability 为空",
        "gap_detail": "梳理可响应本项目技术要求的平台功能与案例，准备功能截图或演示环境",
        "owner": "投标负责人",
        "reviewer": null
      },
      {
        "material_id": "MATREQ-019",
        "material_name": "产品与平台能力材料",
        "material_type": "CAPABILITY",